<?xml version="1.0" encoding="UTF-8"?>

<Dormitory xmlns="http://www.our-example-data.org/dormitory/xsd"
xmlns:xsi="http://www.w3.org/2001/XMLSchema-instance"
xsi:schemaLocation="http://www.our-example-data.org/dormitory/xsd ../schemas/schema-5.xsd"
xmlns:jani="http://www.our-example-data.org/janitor/xsd"
xmlns:stud="http://www.our-example-data.org/student/xsd"
xmlns:uni="http://www.our-example-data.org/university/xsd">
    <address>Praha PÃ¡tkova 2136/3</address>
    <Name xml:lang="cs">17. Listopadu</Name>
    <hasBedBugs>false</hasBedBugs>
    <uni:University>
        <uni:id>2</uni:id>
        <uni:Name xml:lang="en">Charles University</uni:Name>
        <uni:webPage>https://cuni.cz</uni:webPage>
    </uni:University>
    <Janitors></Janitors>
    <DormRooms>
        <DormRoom>
            <Floor>100</Floor>
            <Number>1000</Number>
            <Capacity>3</Capacity>
            <HasToilet>true</HasToilet>
            <Students></Students>
        </DormRoom>
    </DormRooms>
</Dormitory>